{
  "$schema": "https://json-schema.org/draft/2020-12/schema",
  "$id": "https://operate.local/schemas/blueprint-v1.json",
  "title": "Operate interaction blueprint",
  "type": "object",
  "additionalProperties": false,
  "required": ["schemaVersion", "flows"],
  "properties": {
    "$schema": { "type": "string" },
    "schemaVersion": { "const": 1 },
    "app": { "$ref": "#/$defs/app" },
    "routes": { "type": "array", "items": { "$ref": "#/$defs/route" } },
    "capabilities": { "type": "array", "items": { "$ref": "#/$defs/capability" } },
    "contexts": { "type": "array", "items": { "$ref": "#/$defs/context" } },
    "flows": { "type": "array", "minItems": 1, "items": { "$ref": "#/$defs/flow" } }
  },
  "$defs": {
    "id": { "type": "string", "pattern": "^[A-Za-z0-9_-]+(?:\\.[A-Za-z0-9_-]+)*$" },
    "app": {
      "type": "object",
      "additionalProperties": false,
      "properties": {
        "bundleIdentifier": { "type": "string" },
        "displayName": { "type": "string" }
      }
    },
    "selector": {
      "type": "object",
      "additionalProperties": false,
      "anyOf": [
        { "required": ["identifier"] },
        { "required": ["name"] },
        { "required": ["text"] }
      ],
      "properties": {
        "identifier": { "type": "string", "minLength": 1 },
        "role": { "type": "string" },
        "name": { "type": "string", "minLength": 1 },
        "text": { "type": "string", "minLength": 1 },
        "above": { "type": "string" },
        "below": { "type": "string" },
        "descendantOf": { "type": "string" },
        "index": { "type": "integer", "minimum": 0 }
      }
    },
    "predicate": {
      "type": "object",
      "additionalProperties": false,
      "required": ["kind"],
      "properties": {
        "kind": {
          "enum": ["route", "visible", "absent", "enabled", "selected", "value", "text", "progressComplete", "appIdle", "noCrash"]
        },
        "route": { "$ref": "#/$defs/id" },
        "selector": { "$ref": "#/$defs/selector" },
        "equals": { "type": "string" },
        "matches": { "type": "string" }
      }
    },
    "parameter": {
      "type": "object",
      "additionalProperties": false,
      "required": ["type"],
      "properties": {
        "type": { "enum": ["string", "number", "boolean", "enum"] },
        "required": { "type": "boolean" },
        "values": { "type": "array", "items": { "type": "string" } },
        "sensitive": { "type": "boolean" }
      }
    },
    "input": {
      "type": "object",
      "additionalProperties": false,
      "oneOf": [
        { "required": ["literal"] },
        { "required": ["parameter"] },
        { "required": ["secret"] }
      ],
      "properties": {
        "literal": true,
        "parameter": { "$ref": "#/$defs/id" },
        "secret": { "$ref": "#/$defs/id" }
      }
    },
    "route": {
      "type": "object",
      "additionalProperties": false,
      "required": ["id", "title", "match"],
      "properties": {
        "id": { "$ref": "#/$defs/id" },
        "title": { "type": "string", "minLength": 1 },
        "match": { "type": "array", "minItems": 1, "items": { "$ref": "#/$defs/predicate" } }
      }
    },
    "capability": {
      "type": "object",
      "additionalProperties": false,
      "required": ["id", "title", "action", "selector"],
      "properties": {
        "id": { "$ref": "#/$defs/id" },
        "title": { "type": "string", "minLength": 1 },
        "route": { "$ref": "#/$defs/id" },
        "resultsIn": { "$ref": "#/$defs/id" },
        "action": {
          "enum": ["tap", "doubleTap", "longPress", "type", "clear", "toggle", "select", "scrollUp", "scrollDown", "swipe", "drag", "setSlider", "dismiss", "back"]
        },
        "selector": { "$ref": "#/$defs/selector" },
        "parameters": {
          "type": "object",
          "additionalProperties": { "$ref": "#/$defs/parameter" }
        },
        "risk": { "enum": ["readOnly", "reversible", "destructive", "external"] }
      }
    },
    "step": {
      "type": "object",
      "additionalProperties": false,
      "required": ["id", "title", "kind"],
      "properties": {
        "id": { "$ref": "#/$defs/id" },
        "title": { "type": "string", "minLength": 1 },
        "kind": { "enum": ["navigate", "invoke", "assert", "repeatUntil"] },
        "route": { "$ref": "#/$defs/id" },
        "capability": { "$ref": "#/$defs/id" },
        "arguments": { "type": "object", "additionalProperties": { "$ref": "#/$defs/input" } },
        "predicate": { "$ref": "#/$defs/predicate" },
        "expect": { "type": "array", "items": { "$ref": "#/$defs/predicate" } },
        "until": { "$ref": "#/$defs/predicate" },
        "maximumIterations": { "type": "integer", "minimum": 1, "maximum": 1000 },
        "steps": { "type": "array", "minItems": 1, "items": { "$ref": "#/$defs/step" } }
      },
      "allOf": [
        { "if": { "properties": { "kind": { "const": "navigate" } } }, "then": { "required": ["route"] } },
        { "if": { "properties": { "kind": { "const": "invoke" } } }, "then": { "required": ["capability"] } },
        { "if": { "properties": { "kind": { "const": "assert" } } }, "then": { "required": ["predicate"] } },
        { "if": { "properties": { "kind": { "const": "repeatUntil" } } }, "then": { "required": ["until", "maximumIterations", "steps"] } }
      ]
    },
    "context": {
      "type": "object",
      "additionalProperties": false,
      "required": ["id", "title", "prepare", "readyWhen"],
      "properties": {
        "id": { "$ref": "#/$defs/id" },
        "title": { "type": "string", "minLength": 1 },
        "requiredSecrets": { "type": "array", "items": { "$ref": "#/$defs/id" } },
        "prepare": { "type": "array", "items": { "$ref": "#/$defs/step" } },
        "readyWhen": { "type": "array", "minItems": 1, "items": { "$ref": "#/$defs/predicate" } }
      }
    },
    "flow": {
      "type": "object",
      "additionalProperties": false,
      "required": ["id", "title", "steps", "acceptance"],
      "properties": {
        "id": { "$ref": "#/$defs/id" },
        "title": { "type": "string", "minLength": 1 },
        "description": { "type": "string" },
        "context": { "$ref": "#/$defs/id" },
        "startRoute": { "$ref": "#/$defs/id" },
        "parameters": { "type": "object", "additionalProperties": { "$ref": "#/$defs/parameter" } },
        "steps": { "type": "array", "minItems": 1, "items": { "$ref": "#/$defs/step" } },
        "acceptance": { "type": "array", "minItems": 1, "items": { "$ref": "#/$defs/predicate" } }
      }
    }
  }
}
